{
  "baseline_distro": "Ubuntu 24.04 LTS, PPD balanced",
  "battery_design_uwh": 0,
  "captured_at": "2026-07-04T12:00:00Z",
  "cpu_model": "Test CPU Model",
  "cpufreq_driver": "intel_pstate",
  "dmi_board": "TestVendor TestBoard",
  "fingerprint": "0123456789abcdef",
  "git_commit": "2a10847d89d4413b9df305c48bb8c4545ce3017e",
  "governor": "powersave",
  "host_kind": "hwtest-host",
  "kernel": "6.1.0-test",
  "ncpu": 8,
  "optid_version": "optid 0.7.0-beta.1",
  "platform_profile_available": true,
  "rapl_domain": "/sys/class/powercap/intel-rapl:0",
  "schema_version": 1,
  "slot": "laptop"
}
